{
    "$schema": "https://json-schema.org/draft/2020-12/schema",
    "$id": "urn:pickle:schemas:decision",
    "title": "Decision Record",
    "description": "Machine-readable Architecture Decision Record. Authors create this file (with decision-id, title, status, narrative) at the start of a decisions/<client>/<version>/<decision-id> branch. The decision lives at architectures/clients/<client>/<version>/decisions/<decision-id>/decision.json — one folder per decision, file always named decision.json. The .github/workflows/decisions-*.yml chain progressively writes each section. Section property names match the kebab-cased workflow names.",
    "type": "object",
    "required": [
        "decision-id",
        "title",
        "status",
        "narrative"
    ],
    "properties": {
        "decision-id": {
            "type": "string",
            "description": "Unique identifier in the form adr-NNN (three-digit number). Must match the parent folder name and the trailing segment of the decision branch name."
        },
        "title": {
            "type": "string",
            "description": "Short human-readable title of the decision"
        },
        "status": {
            "type": "string",
            "enum": [
                "draft",
                "proposed",
                "accepted",
                "rejected",
                "superseded"
            ]
        },
        "narrative": {
            "type": "string",
            "description": "Author's narrative of the proposed change. Read by all downstream workflows."
        },
        "context-validation": {
            "type": "object",
            "description": "Output of the Validate Context workflow. Permissive shape — produces a deterministic outcome + violation list, not the 4-string analysis section shape."
        },
        "architecture-review": {
            "type": "array",
            "items": {
                "$ref": "#/$defs/section"
            },
            "description": "Output of the Architecture Review workflow — one or more findings."
        },
        "referential-integrity": {
            "type": "array",
            "items": {
                "$ref": "#/$defs/section"
            },
            "description": "Output of the Referential Integrity workflow — one or more findings."
        },
        "strategy-alignment": {
            "type": "array",
            "items": {
                "$ref": "#/$defs/section"
            },
            "description": "Output of the Strategy Alignment workflow — one or more findings."
        },
        "principles-alignment": {
            "type": "array",
            "items": {
                "$ref": "#/$defs/section"
            },
            "description": "Output of the Principles Alignment workflow — one or more findings."
        },
        "proponent-analysis": {
            "type": "array",
            "items": {
                "$ref": "#/$defs/section"
            },
            "description": "Output of the Proponent Analysis workflow — one or more findings."
        },
        "challenger-analysis": {
            "type": "array",
            "items": {
                "$ref": "#/$defs/section"
            },
            "description": "Output of the Challenger Analysis workflow — one or more findings."
        }
    },
    "additionalProperties": false,
    "$defs": {
        "section": {
            "type": "object",
            "description": "Shape of a single finding within an analysis section. Each analysis section is an array of these — a workflow may emit multiple findings.",
            "required": [
                "finding",
                "impact",
                "recommendation",
                "rationale"
            ],
            "properties": {
                "finding": {
                    "type": "string",
                    "description": "What the workflow observed — the analytical output."
                },
                "impact": {
                    "type": "string",
                    "description": "Why the finding matters — consequence for the proposed change."
                },
                "recommendation": {
                    "type": "string",
                    "description": "What the author should do in response to the finding."
                },
                "rationale": {
                    "type": "string",
                    "description": "Why the recommendation is the right course of action."
                }
            },
            "additionalProperties": false
        }
    }
}
