{
    "decision-id": "adr-001",
    "title": "Project and Programme Management",
    "status": "draft",
    "narrative": "We require a project and programme management capability in the architecture, represented in the business and application domains",
    "context-validation": {
        "branch-type": "decision",
        "outcome": "fail",
        "allowed-prefix": "architectures/clients/client-a/",
        "changed-files": [
            ".github/scripts/format-decision-for-pr.py",
            ".github/scripts/validate-structure.py",
            ".github/workflows/decisions-architecture-review.yml",
            ".github/workflows/decisions-challenger-analysis.yml",
            ".github/workflows/decisions-principles-alignment.yml",
            ".github/workflows/decisions-proponent-analysis.yml",
            ".github/workflows/decisions-referential-integrity.yml",
            ".github/workflows/decisions-strategy-alignment.yml",
            ".github/workflows/decisions-update-pull-request.yml",
            ".github/workflows/validate-context.yml",
            ".github/workflows/validate-schema.yml",
            ".github/workflows/validate-structure.yml",
            "CLAUDE.md",
            "architectures/client-a/version-1.0.0/decisions/decisions.json",
            "architectures/clients/client-a/1.0.0/artefacts/domains/application/conceptual/APP-STR/APP-STR.json",
            "architectures/clients/client-a/1.0.0/artefacts/domains/application/logical/APP-DAP/APP-DAP.json",
            "architectures/clients/client-a/1.0.0/artefacts/domains/application/logical/APP-DPM/empty",
            "architectures/clients/client-a/1.0.0/artefacts/domains/application/logical/APP-PRN/APP-PRN.json",
            "architectures/clients/client-a/1.0.0/artefacts/domains/application/physical/APP-GRD/APP-GRD.json",
            "architectures/clients/client-a/1.0.0/artefacts/domains/business/conceptual/BUS-BCM/empty",
            "architectures/clients/client-a/1.0.0/artefacts/domains/business/conceptual/BUS-BPM/empty",
            "architectures/clients/client-a/1.0.0/artefacts/domains/business/conceptual/BUS-CAP/BUS-CAP.json",
            "architectures/clients/client-a/1.0.0/artefacts/domains/business/conceptual/BUS-PRO/BUS-PRO.json",
            "architectures/clients/client-a/1.0.0/artefacts/domains/business/conceptual/BUS-STR/BUS-STR.json",
            "architectures/clients/client-a/1.0.0/artefacts/domains/business/logical/BUS-PRN/BUS-PRN.json",
            "architectures/clients/client-a/1.0.0/artefacts/domains/business/physical/BUS-GRD/BUS-GRD.json",
            "architectures/clients/client-a/1.0.0/artefacts/domains/data/conceptual/DAT-CDM/empty",
            "architectures/clients/client-a/1.0.0/artefacts/domains/data/conceptual/DAT-DAC/DAT-DAC.json",
            "architectures/clients/client-a/1.0.0/artefacts/domains/data/conceptual/DAT-STR/DAT-STR.json",
            "architectures/clients/client-a/1.0.0/artefacts/domains/data/logical/DAT-PRN/DAT-PRN.json",
            "architectures/clients/client-a/1.0.0/artefacts/domains/data/physical/DAT-GRD/DAT-GRD.json",
            "architectures/clients/client-a/1.0.0/artefacts/domains/integration/conceptual/INT-STR/INT-STR.json",
            "architectures/clients/client-a/1.0.0/artefacts/domains/integration/logical/INT-PRN/INT-PRN.json",
            "architectures/clients/client-a/1.0.0/artefacts/domains/integration/physical/INT-GRD/INT-GRD.json",
            "architectures/clients/client-a/1.0.0/artefacts/domains/solution/conceptual/SOL-STR/SOL-STR.json",
            "architectures/clients/client-a/1.0.0/artefacts/domains/solution/logical/SOL-PRN/SOL-PRN.json",
            "architectures/clients/client-a/1.0.0/artefacts/domains/solution/physical/SOL-GRD/SOL-GRD.json",
            "architectures/clients/client-a/1.0.0/decisions/adr-001/decision.json",
            "architectures/clients/client-a/1.0.0/decisions/decisions.json",
            "architectures/clients/client-a/1.0.0/version.json",
            "architectures/clients/client-a/client.json",
            "architectures/clients/client-a/versions.json",
            "architectures/clients/clients.json",
            "architectures/references/README.md",
            "documentation/artefacts.md",
            "documentation/schemas/client.md",
            "documentation/schemas/clients.md",
            "documentation/schemas/decision.md",
            "documentation/schemas/decisions.md",
            "documentation/schemas/index.md",
            "documentation/schemas/version.md",
            "documentation/schemas/versions.md",
            "documentation/workflows/decisions-pipeline.md",
            "documentation/workflows/decisions-update-pull-request.md",
            "documentation/workflows/index.md",
            "documentation/workflows/validate-context.md",
            "documentation/workflows/validate-schema.md",
            "documentation/workflows/validate-structure.md",
            "prompts/decisions/architecture-review.md",
            "prompts/decisions/challenger-analysis.md",
            "prompts/decisions/principles-alignment.md",
            "prompts/decisions/proponent-analysis.md",
            "prompts/decisions/referential-integrity.md",
            "prompts/decisions/strategy-alignment.md",
            "schemas/client.json",
            "schemas/clients.json",
            "schemas/decision.json",
            "schemas/decisions.json",
            "schemas/version.json",
            "schemas/versions.json"
        ],
        "violations": [
            ".github/scripts/format-decision-for-pr.py",
            ".github/scripts/validate-structure.py",
            ".github/workflows/decisions-architecture-review.yml",
            ".github/workflows/decisions-challenger-analysis.yml",
            ".github/workflows/decisions-principles-alignment.yml",
            ".github/workflows/decisions-proponent-analysis.yml",
            ".github/workflows/decisions-referential-integrity.yml",
            ".github/workflows/decisions-strategy-alignment.yml",
            ".github/workflows/decisions-update-pull-request.yml",
            ".github/workflows/validate-context.yml",
            ".github/workflows/validate-schema.yml",
            ".github/workflows/validate-structure.yml",
            "CLAUDE.md",
            "architectures/client-a/version-1.0.0/decisions/decisions.json",
            "architectures/clients/clients.json",
            "architectures/references/README.md",
            "documentation/artefacts.md",
            "documentation/schemas/client.md",
            "documentation/schemas/clients.md",
            "documentation/schemas/decision.md",
            "documentation/schemas/decisions.md",
            "documentation/schemas/index.md",
            "documentation/schemas/version.md",
            "documentation/schemas/versions.md",
            "documentation/workflows/decisions-pipeline.md",
            "documentation/workflows/decisions-update-pull-request.md",
            "documentation/workflows/index.md",
            "documentation/workflows/validate-context.md",
            "documentation/workflows/validate-schema.md",
            "documentation/workflows/validate-structure.md",
            "prompts/decisions/architecture-review.md",
            "prompts/decisions/challenger-analysis.md",
            "prompts/decisions/principles-alignment.md",
            "prompts/decisions/proponent-analysis.md",
            "prompts/decisions/referential-integrity.md",
            "prompts/decisions/strategy-alignment.md",
            "schemas/client.json",
            "schemas/clients.json",
            "schemas/decision.json",
            "schemas/decisions.json",
            "schemas/version.json",
            "schemas/versions.json"
        ],
        "checked-at": "2026-05-15T08:40:29+00:00"
    }
}
